<?xml version="1.0" encoding="UTF-8"?>
<!DOCTYPE tag-lib PUBLIC "-//Red Hat, Inc//DTD Knowledge Base 2.0//EN" "http://anonsvn.jboss.org/repos/jbosstools/trunk/jst/plugins/org.jboss.tools.jst.web.kb/resources/kbCustomTagLibSchema-1.0.dtd">
<tag-lib defaultPrefix="jQueryMobile" ignoreCase="true">
	<component extended="false" name="a" attributeProvider="org.jboss.tools.jst.web.kb.internal.taglib.jq.PopupAnchorAttributeProvider, org.jboss.tools.jst.web.kb.internal.taglib.jq.AButtonAttributeProvider, org.jboss.tools.jst.web.kb.internal.taglib.jq.LinkAttributeProvider"/>
	<component extended="false" name="button" attributeProvider="org.jboss.tools.jst.web.kb.internal.taglib.jq.ButtonAttributeProvider"/>
	<component extended="false" name="input" attributeProvider="org.jboss.tools.jst.web.kb.internal.taglib.jq.TextInputAndTextareaAttributeProvider, org.jboss.tools.jst.web.kb.internal.taglib.jq.SliderAttributeProvider, org.jboss.tools.jst.web.kb.internal.taglib.jq.RadioButtonAttributeProvider, org.jboss.tools.jst.web.kb.internal.taglib.jq.ButtonAttributeProvider, org.jboss.tools.jst.web.kb.internal.taglib.jq.CheckboxAttributeProvider"/>
	<component extended="false" name="textarea" attributeProvider="org.jboss.tools.jst.web.kb.internal.taglib.jq.TextInputAndTextareaAttributeProvider"/>

	<component extended="false" name="div" attributeProvider="org.jboss.tools.jst.web.kb.internal.taglib.jq.ControlgroupAttributeProvider, org.jboss.tools.jst.web.kb.internal.taglib.jq.PopupAttributeProvider, org.jboss.tools.jst.web.kb.internal.taglib.jq.PageAttributeProvider, org.jboss.tools.jst.web.kb.internal.taglib.jq.PageAttributeProvider, org.jboss.tools.jst.web.kb.internal.taglib.jq.NavbarAttributeProvider, org.jboss.tools.jst.web.kb.internal.taglib.jq.FooterHeaderAttributeProvider, org.jboss.tools.jst.web.kb.internal.taglib.jq.FixedToolbarAttributeProvider, org.jboss.tools.jst.web.kb.internal.taglib.jq.FieldcontainAttributeProvider, org.jboss.tools.jst.web.kb.internal.taglib.jq.EnhancementAttributeProvider, org.jboss.tools.jst.web.kb.internal.taglib.jq.DialogAttributeProvider, org.jboss.tools.jst.web.kb.internal.taglib.jq.CollapsibleAttributeProvider, org.jboss.tools.jst.web.kb.internal.taglib.jq.CollapsibleSetAttributeProvider, org.jboss.tools.jst.web.kb.internal.taglib.jq.ContentAttributeProvider"/>
	<component extended="false" name="fieldset" attributeProvider="org.jboss.tools.jst.web.kb.internal.taglib.jq.ControlgroupAttributeProvider, org.jboss.tools.jst.web.kb.internal.taglib.jq.PopupAttributeProvider, org.jboss.tools.jst.web.kb.internal.taglib.jq.PageAttributeProvider, org.jboss.tools.jst.web.kb.internal.taglib.jq.PageAttributeProvider, org.jboss.tools.jst.web.kb.internal.taglib.jq.NavbarAttributeProvider, org.jboss.tools.jst.web.kb.internal.taglib.jq.FooterHeaderAttributeProvider, org.jboss.tools.jst.web.kb.internal.taglib.jq.FixedToolbarAttributeProvider, org.jboss.tools.jst.web.kb.internal.taglib.jq.FieldcontainAttributeProvider, org.jboss.tools.jst.web.kb.internal.taglib.jq.EnhancementAttributeProvider, org.jboss.tools.jst.web.kb.internal.taglib.jq.DialogAttributeProvider, org.jboss.tools.jst.web.kb.internal.taglib.jq.CollapsibleAttributeProvider, org.jboss.tools.jst.web.kb.internal.taglib.jq.CollapsibleSetAttributeProvider, org.jboss.tools.jst.web.kb.internal.taglib.jq.ContentAttributeProvider"/>

	<component extended="false" name="span" attributeProvider="org.jboss.tools.jst.web.kb.internal.taglib.jq.PopupAttributeProvider, org.jboss.tools.jst.web.kb.internal.taglib.jq.PageAttributeProvider, org.jboss.tools.jst.web.kb.internal.taglib.jq.PageAttributeProvider, org.jboss.tools.jst.web.kb.internal.taglib.jq.NavbarAttributeProvider, org.jboss.tools.jst.web.kb.internal.taglib.jq.FooterHeaderAttributeProvider, org.jboss.tools.jst.web.kb.internal.taglib.jq.FixedToolbarAttributeProvider, org.jboss.tools.jst.web.kb.internal.taglib.jq.FieldcontainAttributeProvider, org.jboss.tools.jst.web.kb.internal.taglib.jq.EnhancementAttributeProvider, org.jboss.tools.jst.web.kb.internal.taglib.jq.DialogAttributeProvider, org.jboss.tools.jst.web.kb.internal.taglib.jq.CollapsibleAttributeProvider, org.jboss.tools.jst.web.kb.internal.taglib.jq.CollapsibleSetAttributeProvider, org.jboss.tools.jst.web.kb.internal.taglib.jq.ContentAttributeProvider"/>

	<component extended="false" name="select" attributeProvider="org.jboss.tools.jst.web.kb.internal.taglib.jq.SelectAttributeProvider, org.jboss.tools.jst.web.kb.internal.taglib.jq.FlipToggleSwitchAttributeProvider"/>

	<component extended="false" name="ol" attributeProvider="org.jboss.tools.jst.web.kb.internal.taglib.jq.ListViewAttributeProvider"/>
	<component extended="false" name="ul" attributeProvider="org.jboss.tools.jst.web.kb.internal.taglib.jq.ListViewAttributeProvider"/>
	<component extended="false" name="li" attributeProvider="org.jboss.tools.jst.web.kb.internal.taglib.jq.ListviewItemAttributeProvider"/>

	<component extended="false" name="table" attributeProvider="org.jboss.tools.jst.web.kb.internal.taglib.jq.TableAttributeProvider"/>
	<component extended="false" name="th" attributeProvider="org.jboss.tools.jst.web.kb.internal.taglib.jq.ThAttributeProvider"/>
</tag-lib>